<?xml version="1.0" encoding="UTF-8" ?>
<xs:schema xmlns:xs="http://www.w3.org/2001/XMLSchema">
  <xs:element name="mapping">
    <xs:complexType>
      <xs:sequence>
        <xs:element maxOccurs="unbounded" name="entity">
          <xs:complexType>
            <xs:sequence>
              <xs:element name="name" type="xs:string" />
              <xs:element name="can_have_content" type="xs:boolean" />
              <xs:element name="properties">
                <xs:complexType>
                  <xs:sequence>
                    <xs:element maxOccurs="unbounded" name="property">
                      <xs:complexType>
                        <xs:sequence>
                          <xs:element name="from" type="xs:string" />
                          <xs:element name="to" type="xs:string" />
                        </xs:sequence>
                      </xs:complexType>
                    </xs:element>
                  </xs:sequence>
                </xs:complexType>
              </xs:element>
            </xs:sequence>
          </xs:complexType>
        </xs:element>
      </xs:sequence>
    </xs:complexType>
  </xs:element>
</xs:schema> 